Document Title,Authors,Author Affiliations,Publication Year,Abstract,DOI,PDF Link,Author Keywords,Article Citation Count,Patent Citation Count,Reference Count
Iterative Predictor-Critic Code Decoding for Real-World Image Dehazing,J. Fu; S. Liu; Z. Liu; C. -L. Guo; H. Park; R. Wu; G. Wang; C. Li,"VCIP, CS, Nankai University; VCIP, CS, Nankai University; Samsung R&D Institute China-Beijing; VCIP, CS, Nankai University; CIG, Samsung Electronics; VCIP, CS, Nankai University; Donghai Laboratory, Zhoushan; VCIP, CS, Nankai University",2025,"We propose a novel Iterative Predictor-Critic Code Decoding framework for real-world image dehazing, abbreviated as IPC-Dehaze, which leverages the high-quality codebook prior encapsulated in a pre-trained VQGAN. Apart from previous codebook-based methods that rely on oneshot decoding, our method utilizes high-quality codes obtained in the previous iteration to guide the prediction of the Code-Predictor in the subsequent iteration, improving code prediction accuracy and ensuring stable dehazing performance. Our idea stems from the observations that 1) the degradation of hazy images varies with haze density and scene depth, and 2) clear regions play crucial cues in restoring dense haze regions. However, it is nontrivial to progressively refine the obtained codes in subsequent iterations, owing to the difficulty in determining which codes should be retained or replaced at each iteration. Another key insight of our study is to propose CodeCritic to capture interrelations among codes. The CodeCritic is used to evaluate code correlations and then resample a set of codes with the highest mask scores, i.e., a higher score indicates that the code is more likely to be rejected, which helps retain more accurate codes and predict difficult ones. Extensive experiments demonstrate the superiority of our method over state-of-the-art methods in real-world dehazing. Our project page can be found at https://github.com/Jiayi-Fu/IPC-Dehaze.",10.1109/CVPR52734.2025.01185,https://ieeexplore.ieee.org/stamp/stamp.jsp?arnumber=11094652,real-world image dehazing;iterative decoding;deep prior,10,,43
Dehazing Underwater Images Using Encoder Decoder Based Generic Model-Agnostic Convolutional Neural Network,R. Thomas; L. Thampi; S. Kamal; A. A. Balakrishnan; T. P. Mithun Haridas; M. H. Supriya,"Department of Electronics, Cochin University of Science & Technology, Kochi, India; Department of Electronics, Cochin University of Science & Technology, Kochi, India; Department of Electronics, Cochin University of Science & Technology, Kochi, India; Department of Electronics, Cochin University of Science & Technology, Kochi, India; Department of Electronics, Cochin University of Science & Technology, Kochi, India; Department of Electronics, Cochin University of Science & Technology, Kochi, India",2021,"Enhancing degraded underwater images is a challenging problem for researchers. Deep learning approaches can significantly provide improvement in image restoration and enhancement. Moreover automatic analysis of marine digital data has a high research demand. This paper aims to introduce a fully connected convolutional neural network for dehazing underwater images. The low level and high level features are integrated by an encoder-decoder deep framework which helps to recover the hazy image. The proposed method is evaluated quantitatively and qualitatively on Underwater Image Enhancement Benchmark dataset (UIEB). The model outperforms existing methods in terms of metrics: SSIM, PSNR and MSE and has the ability to dehaze underwater images retaining fine details.",10.1109/SYMPOL53555.2021.9689441,https://ieeexplore.ieee.org/stamp/stamp.jsp?arnumber=9689441,Dehazing;Encoder-Decoder;Underwater Images;Deep Learning,10,,10
DFR-Net: Density Feature Refinement Network for Image Dehazing Utilizing Haze Density Difference,Z. Wang; H. Zhao; L. Yao; J. Peng; K. Zhao,"East China University of Science and Technology, Shanghai, China; East China University of Science and Technology, Shanghai, China; East China University of Science and Technology, Shanghai, China; East China University of Science and Technology, Shanghai, China; East China University of Science and Technology, Shanghai, China",2024,"In the image dehazing task, the haze density is a key feature that affects the performance of dehazing methods. The haze density difference, which has rarely been utilized in previous methods, can guide networks to perceive different global densities and focus on local areas with high density or that are difficult to dehaze. In this paper, we propose a density-aware dehazing method named the Density Feature Refinement Network (DFR-Net), which extracts haze density features from density differences and leverages density differences to refine density features. In DFR-Net, we first generate a proposal image that has a lower overall density than the hazy input, resulting in global density differences. Additionally, the dehazing residual of the proposal image reflects the level of dehazing performance and provides local density differences that indicate localized hard dehazing or high-density areas. Subsequently, we introduce a Global Branch (GB) and a Local Branch (LB) to achieve density awareness. In GB, we use Siamese networks for feature extraction of hazy inputs and proposal images, and we propose a Global Density Feature Refinement (GDFR) module that can refine features by pushing features with different global densities further away. In LB, we explore local density features from the dehazing residuals between hazy inputs and proposal images and introduce an Intermediate Dehazing Residual Feedforward (IDRF) module to update local features and pull them close to clear image features. Sufficient experiments demonstrate that the proposed method outperforms state-of-the-art methods on various datasets.",10.1109/TMM.2024.3369979,https://ieeexplore.ieee.org/stamp/stamp.jsp?arnumber=10444969,Deep learning;density-aware;image dehazing;image enhancement;image restoration,10,,54
Video haze removal and poisson blending based mini-mosaics for wide area motion imagery,R. Aktar; V. B. Surya Prasath; H. Aliakbarpour; U. Sampathkumar; G. Seetharaman; K. Palaniappan,"Department of Computer Science, Computational Imaging and VisAnalysis (CIVA) Lab, University of Missouri-Columbia, MO, USA; Department of Computer Science, Computational Imaging and VisAnalysis (CIVA) Lab, University of Missouri, Columbia, MO, US; Department of Computer Science, Computational Imaging and VisAnalysis (CIVA) Lab, University of Missouri-Columbia, MO, USA; Department of Computer Science, Computational Imaging and VisAnalysis (CIVA) Lab, University of Missouri-Columbia, MO, USA; US Naval Research Laboratory, Washington, D.C., USA; Department of Computer Science, Computational Imaging and VisAnalysis (CIVA) Lab, University of Missouri-Columbia, MO, USA",2016,"In this work we consider three different haze removal approaches to dehaze videos with applications wide area motion imagery (WAMI). Out of three, we mainly focused on dark channel haze removal method. Most of the haze-free nonsky outdoor images contain at least one color channel with average intensity close to zero; this channel is called dark channel and provides a good estimate of the transmission of haze which is used to remove haze from image. By utilizing neighborhood consistency in temporal direction of videos we apply haze removal algorithm sequentially. Once the haze-free images are produced, we register them in order to generate mini-mosaics and apply poison blending to remove seam effect from the mini-mosaics. Additionally, in order to avoid dehazing each image, we create the mini-mosaic first and the apply dehazing on the mini-mosaic only. Experimental results on synthetic image sequences and WAMI indicate we obtain good haze-free and mosaiced results in both approaches.",10.1109/AIPR.2016.8010552,https://ieeexplore.ieee.org/stamp/stamp.jsp?arnumber=8010552,,10,,15
A Review on GAN based Image Dehazing,K. Singh; V. Khare; V. Agarwal; S. Sourabh,"Dept. of Computer Science, Delhi Technological University, New Delhi, India; Dept. of Computer Science, Delhi Technological University, New Delhi, India; Dept. of Computer Science, Delhi Technological University, New Delhi, India; Dept. of Computer Science, Delhi Technological University, New Delhi, India",2022,"The improvement of deep learning facilitated the evolution of computer vision methods. Image dehazing is one of the challenging tasks in computer vision. Haze is a very common phenomenon arising due to bad weather, poor lighting, pollution, etc. Haze poses the problem of poor visibility in images under extreme circumstances. Several deep learning-based methods have been used to overcome haze-oriented problems. Generative networks (GANs) focus on the distribution of the normal images to remove the haze from a hazy image. The methods enhance the performance of computer vision under hazy conditions. This paper focuses on discussing a few important techniques, specially GANs, to solve the problem of dehazing. Various techniques have been qualitatively analyzed and the merits and demerits of the respective models have been discussed. Finally, some light is thrown upon the real-world applications and significance of dehazing.",10.1109/ICICCS53718.2022.9788377,https://ieeexplore.ieee.org/stamp/stamp.jsp?arnumber=9788377,Generative Adversarial Network;Dehaze;Neural networks;Deep learning,10,,29
Reading Various Types of Pointer Meters Under Extreme Motion Blur,H. Zhang; Y. Rao; J. Shao; F. Meng; J. Pu,"School of Information and Software Engineering, University of Electronic Science and Technology of China, Chengdu, China; School of Information and Software Engineering, University of Electronic Science and Technology of China, Chengdu, China; School of Computer Science and Engineering, University of Electronic Science and Technology of China, Chengdu, China; School of Information and Communication Engineering, University of Electronic Science and Technology of China, Chengdu, China; School of Computer Science and Engineering, University of Electronic Science and Technology of China, Chengdu, China",2023,"Automatically reading pointer meters using deep learning has yielded promising results with high precision. However, existing methods ignore the interference with the camera brought by moving devices (e.g., patrol robots and drones), thus the persistent motion blur caused by the camera shake is not properly addressed. It is noteworthy that reading the pointer meter relies heavily on semantic segmentation of the scale and pointer within the meter. However, this can be challenging in extreme motion blur and diverse substation scenes. Moreover, reading various types of pointer meters and out-of-range pointer check remain tough issues. Thus, in this study, a full pipeline is proposed to solve the problems mentioned above. First, Filter-Deblur-U-net (FD-U-net) is proposed to ensure accurate segmentation under motion blur. To be specific, FD-U-net is a one-stage network consisting of a deblurring module and a segmentation module. The segmentation loss supervises the optimization of the deblurring module. And the proposed high-frequency residual attention (HFRA) in FD-U-net meticulously refines the details of motion-blurred image at the texture accumulated stage. Furthermore, the judgment-reading-algorithm (JRA) is developed to complete readings of 35 types of meters. To ensure practical application, we propose the data augmentation strategy called motion-blur-MixUp (MB-MixUp) to maintain precise meter localization under motion blur. Additionally, we propose a method called dark channel prior dehaze Laplace (DCPD-Laplace) to determine whether the meter patch is motion-blurred. Experimental results have demonstrated the whole pipeline achieves state-of-the-art performance with average relative error and average reference error of only 1.54% and 0.48%, respectively.",10.1109/TIM.2023.3290962,https://ieeexplore.ieee.org/stamp/stamp.jsp?arnumber=10168939,Image deblurring;motion blur;object detection;pointer meter recognition;semantic segmentation,10,,50
Three-Dimensional Reconstruction of Secondary Arc Based on Improved Binocular Stereo Vision Method,H. Cong; Y. Wang; D. Han; L. Qiao; S. Wang; W. Zhao; Q. Li,"State Key Laboratory of Alternate Electrical Power System with Renewable Energy Sources, North China Electric Power University, Beijing, China; State Key Laboratory of Alternate Electrical Power System with Renewable Energy Sources, North China Electric Power University, Beijing, China; State Key Laboratory of Alternate Electrical Power System with Renewable Energy Sources, North China Electric Power University, Beijing, China; State Key Laboratory of Alternate Electrical Power System with Renewable Energy Sources, North China Electric Power University, Beijing, China; State Key Laboratory of Alternate Electrical Power System with Renewable Energy Sources, North China Electric Power University, Beijing, China; State Key Laboratory of Advanced Power Transmission Technology, Global Energy Interconnection Research Institute Company Ltd., Beijing, China; State Key Laboratory of Alternate Electrical Power System with Renewable Energy Sources, North China Electric Power University, Beijing, China",2023,"The secondary arc’s 3-D spatial morphology is significant for the study of its suppression technology. However, the brightness of secondary arc is high and the spatial morphology is complex. In addition, the haze-like plasma causes shielding and interruption on arc reconstruction. The reconstruction quality is seriously affected. Consequently, to obtain accurate physical parameters of secondary arc, a 3-D reconstruction experimental platform based on binocular stereo vision was built. In view of the unique haze-like plasma occlusion and arc interruption phenomenon of secondary arc image, this article used the dehazing algorithm based on the atmospheric scattering model to dehaze and enhance the arc image. A double-threshold recovery algorithm based on the grayscale of secondary arc image was used to repair intermittent arcs. Then, based on the optimized disparity map, the 3-D image of secondary arc was reconstructed. Results show that there are spatial differences in the shape changes of secondary arc. Moreover, the variation in arc length and diameter is divided into two stages. Compared with the previous work, this article realizes the 3-D reconstruction of secondary arc, and the shape of the arc is more realistic, which can provide a reference for exploring the physical characteristics of secondary arc.",10.1109/TIM.2023.3273671,https://ieeexplore.ieee.org/stamp/stamp.jsp?arnumber=10121169,3-D reconstruction;arc length;image processing;secondary arc;spatial shape,10,,27
Single-Image Dehazing Using Extreme Reflectance Channel Prior,Y. Zhang; K. Gao; J. Wang; X. Zhang; H. Wang; Z. Hua; Q. Wu,"Key Laboratory of Photoelectronic Imaging Technology and System, Ministry of Education of China, Beijing Institute of Technology, Beijing, China; Key Laboratory of Photoelectronic Imaging Technology and System, Ministry of Education of China, Beijing Institute of Technology, Beijing, China; Key Laboratory of Photoelectronic Imaging Technology and System, Ministry of Education of China, Beijing Institute of Technology, Beijing, China; Key Laboratory of Photoelectronic Imaging Technology and System, Ministry of Education of China, Beijing Institute of Technology, Beijing, China; Key Laboratory of Photoelectronic Imaging Technology and System, Ministry of Education of China, Beijing Institute of Technology, Beijing, China; Key Laboratory of Photoelectronic Imaging Technology and System, Ministry of Education of China, Beijing Institute of Technology, Beijing, China; Key Laboratory of Photoelectronic Imaging Technology and System, Ministry of Education of China, Beijing Institute of Technology, Beijing, China",2021,"Image dehazing algorithms based on dark channel prior principle have achieved good results for most scenes. However, the popular dark channel prior tends to underestimate transmissions of bright areas or objects, such as the skies, white areas and self-luminous bodies, which may cause color distortions during dehazing. A complementary prior called the extreme reflectance channel prior (ERC), which combines the dark channel prior with the bright channel prior, is proposed to estimate the transmission map. The extreme reflectance channel is the union of dark and bright channel’s pixels which satisfy the corresponding channel. Based on the scattering analysis results that the intensities of pixels in ERC are often close to 0 or 1 for the natural haze-free images or close to global atmospheric light if hazes occur in the air, the pixels in a hazy image can be recovered according to ERC to calculate the transmission map and then solve the haze imaging mode. Experiments show that ERC method outperforms state-of-the-art methods in PSNR, SSIM and visual perception effects.",10.1109/ACCESS.2021.3090202,https://ieeexplore.ieee.org/stamp/stamp.jsp?arnumber=9458304,Dehaze;extreme reflectance channel;transmission map,9,,59
Image Dehaze Algorithm Based on Improved Atmospheric Scattering Models,W. Yan; L. Cui,"School of Intelligent Intelligence and Control Engineering, Shanghai Polytechnic University, Shanghai, China; School of Intelligent Intelligence and Control Engineering, Shanghai Polytechnic University, Shanghai, China",2024,"Due to the influence of rainy and foggy weather, obtaining clear images becomes more challenging, often resulting in low visibility, poor contrast, and missing detail information. To address these issues, a robust image defogging algorithm is proposed. Firstly, the input image undergoes conversion into a detailed image, with attenuation and redefinition of its three color channels. Color compensation and balance are then applied based on the principle of minimizing color loss. Secondly, the problem of image darkening is tackled through an improved atmospheric scattering model (EASM) and the dark channel a priori algorithm. The defogging results exhibit noticeable enhancements in terms of bright colors and clear details. In the natural images showcased in the paper, the proposed algorithm achieves improvements in information entropy, the fog density evaluator (FADE), and the natural image quality evaluator (NIQE) by 0.46%, 9.7%, and 12.0%, respectively, compared to the suboptimal algorithm. In the synthetic image datasets I-HAZE and O-HAZE, there are enhancements in information entropy by 0.19% and 0.76%, respectively, and in NIQE by 1.05% each, albeit slightly lower than the sub-optimal results. The structural similarity (SSIM) also sees improvements of 6.3% and 10.9% compared to the suboptimal results in FADE. These findings demonstrate the superior performance of the proposed algorithm over the latest defogging algorithms in terms of information entropy, FADE, NIQE, and SSIM, underscoring its high robustness and promising application prospects.",10.1109/ACCESS.2024.3428568,https://ieeexplore.ieee.org/stamp/stamp.jsp?arnumber=10599191,Image processing;haze removal;atmospheric scattering model;color correction;gray world assumption,9,,25
Single Image Dehazing Jointly Utilizing Dark Channel Prior and Guided Filtering in Dual-Tree Complex Wavelet Domain,Y. Dongqiao; H. Yuanyuan; T. Haozhe; H. Xi; Q. Zhi,"Department of Network Engineering, Chengdu University of Information Technology, Chengdu, China; Department of Network Engineering, Chengdu University of Information Technology, Chengdu, China; Department of Network Engineering, Chengdu University of Information Technology, Chengdu, China; Department of Network Engineering, Chengdu University of Information Technology, Chengdu, China; Department of Network Engineering, Chengdu University of Information Technology, Chengdu, China",2020,"In this paper, a new image haze removal algorithm is proposed by jointly utilizing dark channel prior and guided filtering in dual-tree complex wavelet transform domain. The algorithm firstly uses guided filtering to smooth the hazing image, then adopts dual-tree complex wavelet transform to decompose the hazing image into low-frequency and high-frequency sub-band components, and then uses the dark channel prior model to process the low-frequency sub-band of the image, finally adopts inverse dual-tree complex wavelet transform to get the dehazed image. The dark channel prior comes from the statistical law of the outdoor fog-free image datasets. Since dual-tree complex wavelet transform has approximate translation advantages such as degeneration, higher positioning accuracy, computational efficiency, and guided filtering can increase the scope of application of haze removal, which can greatly reduce the optimization time of initial transmittance and the complexity of the entire algorithm. Therefore, the new proposed algorithm outperforms traditional dark channel prior based defogging algorithm. The experimental results show that the proposed algorithm can effectively improve the contrast and clarity of the image.",10.1109/ICCWAMTIP51612.2020.9317496,https://ieeexplore.ieee.org/stamp/stamp.jsp?arnumber=9317496,Dehaze;Dark channel prior;Guided filtering;Dual-tree complex wavelet transform,9,,7
Remote Sensing Images Dehazing Algorithm based on Cascade Generative Adversarial Networks,X. Sun; J. Xu,"School of Computer and Control Engineering, Yantai University, Yantai, China; School of Computer and Control Engineering, Yantai University, Yantai, China",2020,"The existing remote sensing image dehazing methods based on deep learning networks usually use pairs of clear images and corresponding haze images to train the model. However, pairs of clear images and their haze counterparts are extremely lacking, and synthetically haze images could not accurately simulate the real haze generation process in real-world scenarios. To address this problem, a cascade method combining two GANs (generative adversarial networks) is proposed. It contains a learning-to-haze GAN (UGAN) and learning-to-dehaze GAN (PAGAN). UGAN learns how to haze remote sensing images with unpaired clear and haze images sets, and then guides the PAGAN to learn how to correctly dehaze such images. To reduce the discrepancy between real haze and synthetic haze images, we added self-attention mechanism to PAGAN. The details can be generated using cues from all feature locations. Moreover, the discriminator could check that highly detailed features in distant portions of the images that are consistent with each other. Compared with other dehazing methods, this algorithm does not require numerous pairs of images to train the network repeatedly. And the results show that the cascaded generative adversarial networks has visual and quantitative effectiveness for the removal of haze, thin clouds.",10.1109/CISP-BMEI51763.2020.9263540,https://ieeexplore.ieee.org/stamp/stamp.jsp?arnumber=9263540,generative adversarial networks;dehazing;visual attention;remote sensing images;cloud removal,9,,24
Dehazing with improved heterogeneous atmosphere light estimation and a nonlinear color attenuation prior model,S. Zhang; C. Qing; X. Xu; J. Jin; H. Qin,"School of Electronic and Information Engineering, South China University of Technology, Guangzhou, China; School of Electronic and Information Engineering, South China University of Technology, Guangzhou, China; School of Electronic and Information Engineering, South China University of Technology, Guangzhou, China; School of Electronic and Information Engineering, South China University of Technology, Guangzhou, China; School of Electronic and Information Engineering, South China University of Technology, Guangzhou, China",2016,"In this paper, we propose an improved heterogeneous atmosphere light estimation method and a novel depth estimation algorithm with Color Attenuation Prior (CAP) to dehaze single image. Firstly, it estimates the atmosphere light with mean-pooling on the illuminance component from HSV color space. The estimated atmosphere light is more robust because of its independence of a specified pixel. Secondly, the scene depth is estimated by a nonlinear CAP model which can overcome the defects of the occurrence of negative scene depths from the linear CAP model. Experimental results demonstrate that the proposed algorithm outperforms the state-of-the-art methods in dehazing images.",10.1109/CSNDSP.2016.7573967,https://ieeexplore.ieee.org/stamp/stamp.jsp?arnumber=7573967,Color Attenuation Prior;dehaze;nonlinear CAP model;heterogeneous atmosphere light;mean-pooling,9,,17
