Document Title,Authors,Author Affiliations,Publication Year,Abstract,DOI,PDF Link,Author Keywords,Article Citation Count,Patent Citation Count,Reference Count
Progressive Back-Traced Dehazing Network Based on Multi-Resolution Recurrent Reconstruction,Q. Yi; A. Jiang; J. Li; J. Wan; M. Wang,"School of Computer and Information Engineering, Jiangxi Normal University, Nanchang, China; School of Computer and Information Engineering, Jiangxi Normal University, Nanchang, China; Department of Computer Science and Technology, East China Normal University, Shanghai, China; School of Computer and Information Engineering, Jiangxi Normal University, Nanchang, China; School of Computer and Information Engineering, Jiangxi Normal University, Nanchang, China",2020,"In order to alleviate adverse impacts of haze on high-level vision tasks, image dehazing attracts great attention from computer vision research field in recent years. Most of existing methods are grouped into physical prior based and non-physical data-driven based categories. However, image dehazing is a challenging ill-conditioned and inherently ambiguous problem. Due to random distribution and concentration of haze, color distortion and excessive brightness often happen in physical prior based methods. Defects on high-frequency details' recovery are not solved well in non-physical data-driven methods. Therefore, to overcome these obstacles, in this paper, we have proposed an effective progressive back-traced dehazing network based on multi-resolution recurrent reconstruction strategies. A kind of irregular multi-scale convolution module is proposed to extract fine-grain local structures. And a kind of multi-resolution residual fusion module is proposed to progressively reconstruct intermediate haze-free images. We have compared our method with several popular state-of-the-art methods on public RESIDE and 2018 NTIRE Dehazing datasets. The experiment results demonstrate that our method could restore satisfactory high-frequency textures and high-fidelity colors. Related source code and parameters will be distributed on Github for further study.",10.1109/ACCESS.2020.2981491,https://ieeexplore.ieee.org/stamp/stamp.jsp?arnumber=9039631,Image dehaze;image enhancement;multiscale fusion;haze removal;image restoration,3,,24
Research on Single Image Dehazing Enhancement Method Based on CycleGAN,Y. Wang; J. Li; J. Song; B. Li; L. Sun,"School of Dalian University of Technology, Dalian, China; International Business Machines (Dalian) Co., Ltd, Dalian, China; School of Dalian University of Technology, Dalian, China; School of Dalian University of Technology, Dalian, China; School of Dalian University of Technology, Dalian, China",2020,"Although researchers have made great progress in image dehazing recently, there are still great challenges in balancing the suitable universality and dehazing accuracy. In this paper, we propose the dark channel prior cycle dehaze network (DCP-Cycle-Dehaze) to single image dehazing. This network is based on CycleGAN, which adds DCP loss based on dark channel prior knowledge and improved cycle perceptual loss to achieve image dehazing function. DCP-Cycle-Dehaze mainly enhance the dehazing capacity of model by enhancing the sensitivity of network for haze features during training. It further improves the performance of the CycleGAN network framework in image dehazing tasks, and makes the network still reach the accuracy of supervised training without unsupervised training. We conduct simulation experiments on four representative data sets: O-HAZE, I-HAZE, RESIDE and D-Hazy. The experimental results show that DCP-Cycle-Dehaze network we proposed has achieved very good results in outdoor environment, the results on the O-HAZE dataset exceed the best results of NTIRE2018; moreover, it also has better results on the indoor environment. The experimental results prove the effectiveness of our method from a quantitative and qualitative perspective.",10.1109/ICAICA50127.2020.9182501,https://ieeexplore.ieee.org/stamp/stamp.jsp?arnumber=9182501,single image dehazing;CycleGAN;dark channel prior loss;perceptual loss,3,,39
An Introductory Study on Image Quality of Dehazed Images,A. Y. Azizah; L. Rahadianti; H. Deborah,"Faculty of Computer Science, Universitas Indonesia, Depok, Indonesia; Faculty of Computer Science, Universitas Indonesia, Depok, Indonesia; Department of Computer Science, NTNU-Norwegian University of Science and Technology, Gjøvik, Norway",2020,"In real World conditions, e.g., fog and haze, the surrounding environment contains a large number of microparticles. This creates a medium which interferes with propagating light, changing the appearance of objects within it. When a digital image is captured in this type of medium, the image will be hazy due to blurring and loss of detail. This is a problem for many automated computer vision methods which utilize visual cues in the image. Multiple methods have been proposed to perform image dehazing, but it is difficult to standardize the perceived quality of the estimated clear image. A highly accurate estimation is not always possible because the nature of the problem is m-posed and an exact clear ground truth is usually unavailable. In fact, the goal of many dehazing methods is to simply obtain a visually pleasing understandable image. In this paper, the Pix2pix image to image translation network and the Contrast Limited Adaptive Histogram Equalization (CLAHE) image enhancement method are used to dehaze hazy images. The resulting clear images will be subject to both subjective and objective image quality assessments. Lastly, this paper will also provide an analysis to discuss the important factors in the attempt to obtain a better dehazed image.",10.1109/ICACSIS51025.2020.9263131,https://ieeexplore.ieee.org/stamp/stamp.jsp?arnumber=9263131,,3,,23
Through the Real World Haze Scenes: Navigating the Synthetic-to-Real Gap in Challenging Image Dehazing,S. Chen; M. Mahdizadeh; C. Yu; J. Fan; T. Chen,"School of Information Science and Technology, Fudan University, Shanghai, China; School of Information Science and Technology, Fudan University, Shanghai, China; Academy for Engineering and Technology, Fudan University, Shanghai, China; Academy for Engineering and Technology, Fudan University, Shanghai, China; School of Information Science and Technology, Fudan University, Shanghai, China",2024,"Dehazing real-world hazy images is challenging due to the complexity of natural haze, varying haze conditions, details preservation, and the risk of overexposure. Existing methods excel in synthetic hazy scenarios but struggle in the real world because they don’t use all available features. Classical dehazing techniques primarily focus on low-level dehazing enhancements, whereas deep learning-based methods extract more intricate weather-related features. However, both of these approaches exhibit limitations in effectively addressing the real-world dehazing. To address these challenges, we introduce an innovative approach that combines the strengths of both modalities to dehaze and enhance the visibility of real-world hazy scenes. Firstly, we extract both low-level and deep features and then employ a pre-trained vector quantization GAN to create well-detailed data patches. A decoder, with a normalized module, effectively utilizes these high-quality features. Additionally, we introduce a controllable operation to improve feature matching. To further enhance dehazing and generalizability, the decoder’s output undergoes a sequence of gamma-correction operations and generates a series of multi-exposure images that are combined to create a haze-free and higher-quality image. Our method effectively reduces haziness, enhances sharpness, preserves natural colors, and minimizes artifacts in challenging real-world scenarios. The approach surpasses five SOTA methods in both qualitative and quantitative evaluations across three key metrics, utilizing three synthetic and two real-world hazy datasets. Notably, it achieves a substantial improvement in real-world datasets over the second-best method, with 0.5702 and 0.129 in FADE metrics for the RTTS and Fattal datasets, respectively.",10.1109/ICRA57147.2024.10611709,https://ieeexplore.ieee.org/stamp/stamp.jsp?arnumber=10611709,,3,,43
DehazeDM: Image Dehazing via Patch Autoencoder Based on Diffusion Models,Y. Yang; D. Zou; X. Song; X. Zhang,"College of Computer Science, Chongqing University, Chongqing, China; College of Computer Science, Chongqing University, Chongqing, China; College of Computer Science, Chongqing University, Chongqing, China; College of Computer Science, Chongqing University, Chongqing, China",2023,"Image dehazing is a crucial computer vision application with the primary objective of estimating haze-free images from hazy images. Deep neural network architectures have emerged as the dominant approaches and achieved remarkable progress. However, due to the intricacy, existing dehazing methods need help to train large deep learning networks. This work proposes a novel image dehazing network based on Diffusion Model (DehazeDM). Firstly, by segmenting the image into patches during the sampling procedure, we can dehaze images of arbitrary size. Then we compress the image into the latent space via the auto-encoder model and conduct the diffusion operation in the latent space, significantly decreasing the computational complexity associated with the task while exhibiting negligible effects on the perceptual fidelity of the resultant images. Extensive experiments verify the effectiveness and the superior performance of DehazeDM in image dehazing.",10.1109/SMC53992.2023.10394653,https://ieeexplore.ieee.org/stamp/stamp.jsp?arnumber=10394653,,3,,31
Two Stage Dehazing Framework for Dense and Non-Homogeneous Dehazing,W. Song; Y. Gao; J. Xiong; H. Lin; D. Li; Y. Zhang,"Guangdong University of Technology, Guangzhou, China; Guangdong University of Technology, Guangzhou, China; Guangdong University of Technology, Guangzhou, China; Guangdong University of Technology, Guangzhou, China; Guangdong University of Technology, Guangzhou, China; Guangdong University of Technology, Guangzhou, China",2024,"In real-world environments, haze often causes a decrease in visibility, leading to potentially severe consequences. Although current methods based on the assumption of homogeneous haze density have achieved commendable results, dehazing techniques for non-homogeneous density haze still fall short in terms of visibility restoration and color accuracy. We observe that although single-stage methods have made significant strides, a multi-stage enhancement can further improve dehazing in terms of both visibility and color restoration. In this paper, we propose a two-stage dehaze framework, named Two Stage Dehazing Framework. Our approach consists of a DehazeNet, which does not require specifying a particular model for dehazing and can accept a hazy image as input, producing an clear image of the same dimensions as the original. Two such DehazeNet are sequentially connected to form the final serial DehazeNet. Moreover, to better approximate the output image to real-world scenes, we propose the Multi-Scale Attention Head. Our method achieved third place in NTIRE 2024 Dense and NonHomogeneous Dehazing Challenge, demonstrating outstanding performance metrics in the Peak Signal to Noise Ratio (PSNR), the Structral Similarity Index (SSIM), and the Mean Opinion Score (MOS). Related code will be acailable on code.",10.1109/CVPRW63382.2024.00666,https://ieeexplore.ieee.org/stamp/stamp.jsp?arnumber=10678252,Dehaze;Deep Learning;Convolution Neural Network,3,,44
Under water image enhancement based on linear image interpolation and limited image enhancer techniques,A. Bindhu; O. U. Maheswari,"Dept. of Electronics and Communication Engineering College of Engineering, Guindy Anna University, Chennai, India; Dept. of Electronics and Communication Engineering, College of Engineering, Guindy Anna University, Chennai, India",2017,"The obstacles for images that are taken under the water are haze, low contrast, loss of color, etc. The quality of images that are taken under the water is not clear due to the impurities present in the water and some properties of water. This paper proposes methods to improve the quality of the underwater images. The proposed work in the paper consist of two methods they are Interpolation based Enhancement and Limited Image Enhancer. The First method is based on increasing the resolution of the image and the second method is based on increasing the contrast of the images. The main aim of the paper is to enhance the image that are taken under water. The qualitative for both the algorithms compared with the previous image enhancement techniques.",10.1109/ICSCN.2017.8085692,https://ieeexplore.ieee.org/stamp/stamp.jsp?arnumber=8085692,underwater image;enhancement;dehaze,2,,10
SID-Net: Satellite Image Dehaze Network Using Vision Transformers,A. Satia; S. Arya; S. M. Moorthi,"Dept. of Computer Science Engineering, Pandit Deendayal Energy University, Gandhinagar, India; Space Applications Centre Signal and Image Procssing Area, Ahmedadad, India; Space Applications Centre Signal and Image Procssing Area, Ahmedadad, India",2024,"Image dehazing is a low-level vision task which aims to generate latent haze-free images given their corresponding hazy counterparts. Past few years have seen Convolutional Neural Network (CNN) based methods dominate both low-level as well as high-level computer vision tasks. However, Vision Transformers (ViT), with their self-attention mechanism designed for images have recently made a breakthrough in highlevel and low-level vision tasks. CNN and Transformer based networks have been proved to be really efficient in performing image dehazing given that certain adjustments and changes are made to their architectures. In this work, we propose Satellite Image Dehaze Network (SID-Net) using CNN and Vision Transformer which integrates a modified ViT block in our CNN based network to dehaze the satellite images. SateHaze1k dataset is used to conduct all the experiments. Our study includes the comparison of the performance of our proposed model with state-of-the-art CNN based dehazing models. The proposed model achieves Peak Signal-To-Noise Ratio (PSNR) score of 20.5695 and Structural Similarity Index Measurement (SSIM) of 0.8642 on thickly hazed images. In future, we would also like use corresponding SAR (Synthetic Aperture Radar) data as condition to the optical data to improve the performance of our proposed model.",10.1109/InGARSS61818.2024.10983999,https://ieeexplore.ieee.org/stamp/stamp.jsp?arnumber=10983999,Remote Sensing;Image Dehazing;Convolutional Neural Network;Vision Transformer,2,,14
Lightweight Implementation of a Transformer-based Single Image Dehaze Network,J. Mo; Z. Hao; Z. Tao; H. Lin; C. Yu; D. Lin,"School of Information and Software Engineering, University of Electronic Science and Technology of China, Chengdu, China; School of Information and Software Engineering, University of Electronic Science and Technology of China, Chengdu, China; School of Information and Software Engineering, University of Electronic Science and Technology of China, Chengdu, China; School of Information and Software Engineering, University of Electronic Science and Technology of China, Chengdu, China; School of Information and Software Engineering, University of Electronic Science and Technology of China, Chengdu, China; School of Information and Software Engineering, University of Electronic Science and Technology of China, Chengdu, China",2024,"With the rapid advancement of information technology, image dehazing technology has become increasingly important in many fields. In recent years, a multitude of new image dehazing methods have been proposed and have been widely applied across various sectors. Currently, as the Transformer architecture grows in popularity, this paper considers integrating the Transformer network structure into the domain of image dehazing. The paper aims to optimize the traditional U-shaped dehazing network that utilizes semantic segmentation by reducing the number of network layers to achieve a lightweight design while also improving the network's dehazing performance. Ultimately, the performance and effectiveness of the proposed network in this paper have been evaluated on typical datasets.",10.1109/ICITES62688.2024.10777455,https://ieeexplore.ieee.org/stamp/stamp.jsp?arnumber=10777455,Image dehaze;Transformer;Lightweight,2,,32
Haze image moving window threshold segmentation algorithm based on contrast enhancement,Y. -t. Liang; M. Zhang; K. -b. Zhao; Y. -g. Li,"School of information science & engineering, Henan University of Technology, Zhengzhou, China; School of information science & engineering, Henan University of Technology, Zhengzhou, China; School of information science & engineering, Henan University of Technology, Zhengzhou, China; School of information science & engineering, Henan University of Technology, Zhengzhou, China",2016,"Under the bad weather, scattering of atmospheric particles lead to the degradation of image quality. And then the later image threshold segmentation is affected. We propose a moving-window threshold segmentation algorithm based on contrast enhancement. According to the characteristics of gray levels and by way of different histogram enhancement, the image contrast can be effectively improved. Moving-window threshold segmentation can reconstruct image gray space. In accordance with the certain rules and artificial selection of a small piece of Am XAn, threshold segmentation of sub-block can be done. Then the threshold segmentation of the whole image can be obtained through progressive scan from top to bottom. Then, by combining the split result together and smoothing the image block adjacent joint, the final image segmentation is obtained. The experimental results show that image gray histogram completely enhances the haze image and efficiently restrains the noise.",10.1109/SKIMA.2016.7916247,https://ieeexplore.ieee.org/stamp/stamp.jsp?arnumber=7916247,Dehaze;Contrast enhancement;Moving window;Threshold segmentation,2,,17
A haze density aware adaptive perceptual single image haze removal algorithm,C. He; C. Zhang; Q. Cheng; X. Jin; J. Yin,"Department of Electronic Engineering, Fudan University, Shanghai, China; Department of Electronic Engineering, Fudan University, Shanghai, China; Department of Electronic Engineering, Fudan University, Shanghai, China; Department of Electronic Engineering, Fudan University, Shanghai, China; Department of Electronic Engineering, Fudan University, Shanghai, China",2016,"Haze or fog jeopardizes both environment and image quality, which degrades the quality of subsequent computer vision algorithms. Recently haze removal method in image processing makes significant progress. The existing methods usually require complicated manual parameters setting according to the variance of input. Among them, dehazing method based on dark channel prior is considered to be the most efficient one. However, the problems brought by dark channel prior method including low luminance, sky region distortion and low saturation are inevitable. The proposed dehaze method in this paper can adaptively adjust parameters settings by introducing haze density detection. Besides, the proposed method improves the original dim recovered image by adaptively adjust exposure and color saturation in YCbCr color space. Furthermore, fast guided filter is employed to refine the transmission map. The experimental results show that the proposed method performs better both objectively and subjectively.",10.1109/ICInfA.2016.7832135,https://ieeexplore.ieee.org/stamp/stamp.jsp?arnumber=7832135,Image dehazing;haze removal;haze density prediction;perceptual image processing,2,,22
Cross-Spectral Image Dehaze through a Dense Stacked Conditional GAN Based Approach,P. L. Suarez; A. D. Sappa; B. X. Vintimilla,"Escuela Superior Politécnica del Litoral, ESPOL Polytechnic University, Guayaquil, Ecuador; Edifici O, Computer Vision Center, Bellaterra, Barcelona, Spain; Escuela Superior Politécnica del Litoral, ESPOL Polytechnic University, Guayaquil, Ecuador",2018,"This paper proposes a novel approach to remove haze from RGB images using a near infrared images based on a dense stacked conditional Generative Adversarial Network (CGAN). The architecture of the deep network implemented receives, besides the images with haze, its corresponding image in the near infrared spectrum, which serve to accelerate the learning process of the details of the characteristics of the images. The model uses a triplet layer that allows the independence learning of each channel of the visible spectrum image to remove the haze on each color channel separately. A multiple loss function scheme is proposed, which ensures balanced learning between the colors and the structure of the images. Experimental results have shown that the proposed method effectively removes the haze from the images. Additionally, the proposed approach is compared with a state of the art approach showing better results.",10.1109/SITIS.2018.00062,https://ieeexplore.ieee.org/stamp/stamp.jsp?arnumber=8706148,"Infrared imaging, Dense, Stacked CGAN, Cross spectral, Convolutional networks",2,,26
Underwater image enhancement and dehazing using wavelet based fusion for pipeline corrosion inspection,A. Khan; F. Meriaudeau; S. S. A. Ali; A. S. Malik,"Department of Electrical and Electronic Engineering Universiti Teknologi PETRONAS, Center for Intelligent Signal and Imaging Research (CISIR), Perak, Malaysia; Department of Electrical and Electronic Engineering Universiti Teknologi PETRONAS, Center for Intelligent Signal and Imaging Research (CISIR), Perak, Malaysia; Department of Electrical and Electronic Engineering Universiti Teknologi PETRONAS, Center for Intelligent Signal and Imaging Research (CISIR), Perak, Malaysia; Department of Electrical and Electronic Engineering Universiti Teknologi PETRONAS, Center for Intelligent Signal and Imaging Research (CISIR), Perak, Malaysia",2016,"Most of the underwater images contain a layer of haze, formed by suspended particles in the turbid water that create scattering and absorption of light. Absorption limits the visibility due to light attenuation while scattering blurs the image features, ultimately the underwater images captured by the camera in such a medium, are hazy and degraded as compared to the normal images taken in the atmosphere. In this paper, we are proposing a wavelet-based fusion method to enhance and dehaze the underwater hazy images of corroded pipeline. The main aim of this research is to inspect the underwater pipelines for the corrosion estimation. There are three main stages in the proposed method. At the initial stage, the hazy underwater image of corroded pipeline is enhanced by adjusting its contrast and the color profiles. In the second stage, the wavelet-based decomposition and inverse composition are performed to fuse the enhanced versions into a dehazed image. At the final stage, the corrosion on the surface of the pipeline is estimated. In order to validate the performance, the corrosion is estimated in both hazy and dehazed image.",10.1109/ICIAS.2016.7824071,https://ieeexplore.ieee.org/stamp/stamp.jsp?arnumber=7824071,Dehazing;wavelet;fusion;corrosion inspection,2,,19
Dehazing of Multispectral Remote Sensing Images Using CNN with ResNet,H. S. Babu Avvaru; S. R. Dasarapalli; P. K. Kollu,"Department of Computer Science and Engineering, Velagapudi Ramakrishna Siddhartha Engineering College, Vijayawada, India; Department of Computer Science and Engineering, Velagapudi Ramakrishna Siddhartha Engineering College, Vijayawada, India; Department of Computer Science and Engineering, Velagapudi Ramakrishna Siddhartha Engineering College, Vijayawada, India",2023,"Satellite image utilization for data interpretation has significantly increased in the current scenario. Deep learning techniques have gained widespread popularity for analyzing satellite image data. However, a major challenge in this field is the presence of haze, which hampers accurate interpretation. Haze occurs when fine dust, smoke, or light vapors reduce the air's transparency, resulting in a lack of contrast in affected regions of satellite images. To tackle this issue, atmospheric correction is commonly employed, but it is a complex and time-consuming process that requires knowledge of various geophysical factors to achieve precise results. Hence, the objective of this research is to develop and implement image processing algorithms that can effectively restore pixels affected by haze, thereby improving the interpretability of satellite images. The proposed work consists of two main phases. Firstly, noise reduction techniques will be applied to the images to enhance their quality. In the second phase, a Convolutional Neural Network with a Residual structure will be utilized to dehaze the images. The evaluation of the proposed system will focus on the Kondapalli region and its surrounding areas in the Kondapalli dataset. This research aims to develop a robust solution that can enhance satellite images affected by haze, providing clearer and more interpretable data for various applications. The effectiveness of the proposed system will be compared with the Dark Object Subtraction method.",10.1109/ASIANCON58793.2023.10269956,https://ieeexplore.ieee.org/stamp/stamp.jsp?arnumber=10269956,Image processing;Haze;Atmospheric correction;Dehazing algorithms;Multispectral images,2,,15
