Document Title,Authors,Author Affiliations,Publication Year,Abstract,DOI,PDF Link,Author Keywords,Article Citation Count,Patent Citation Count,Reference Count
Object Detection using Image Dehazing: A Journey Of Visual Improvement,R. Tanwar; Shubham; S. Verma; M. Kumar,"Department of Computer Engineering, Delhi Technological University, New Delhi, India; Department of Computer Engineering, Delhi Technological University, New Delhi, India; Department of Computer Engineering, Delhi Technological University, New Delhi, India; Department of Computer Engineering, Delhi Technological University, New Delhi, India",2022,"Object Detection in hazy conditions is very challenging as haze significantly degrades the visibility of images limits visibility especially in outdoor settings. Here we introduce an interesting method to deal with haze that is present in images. Before applying any object detection method on the hazy input image, it is needed to be dehaze first and recognised later.For dehazing we have used the an Image Dehazing network known as All-in-One Dehazing Network (AOD-net) which is based on reformulation of atmospheric model and generates clean and clear image through a light-weight CNN and for recognition we have used the third version of famous YOLO i.e. YOLOv3. We test our method on various real time hazy images and compare the object similarity results on hazy image as well as on dehaze image. Along with this we have compared the number of object which are recognised in hazy image and in output clear image.",10.1109/CONIT55038.2022.9848085,https://ieeexplore.ieee.org/stamp/stamp.jsp?arnumber=9848085,Image Dehazing;Object Detection;YOLOv3;CNN;AOD-net;ASM,1,,21
Unsupervised Image Dehazing Based on Improved Generative Adversarial Networks,J. Huang; T. Liu; Y. Wang; Z. Chen,"School of Computer and Information Engineering, Fuyang Normal University, Anhui, China; NA; School of Computer and Information Engineering, Fuyang Normal University, Anhui, China; School of Computer and Information Engineering, Fuyang Normal University, Anhui, China",2022,"Image dehazing is a technique used for repairing blurry images which can effectively reduce the impact of haze on visual tasks. Most of the existing dehazing methods rely on atmospheric models or perform supervised learning based on paired images to obtain haze-free images. However, problems such as relying on prior knowledge of a specific scene and difficulty in collecting paired hazy and haze-free images have hindered the development of image dehazing techniques. In response to the above problems, we are inspired by the CycleGAN algorithm and propose the DAM-CCGAN algorithm, which uses an unsupervised method to dehaze unpaired images. For the blur and color distortion problems which can occur in image dehazing, the DAM-CCGAN algorithm adds a skip connection method and an attention mechanism module (DAM) to the generator. To preserve more image information, we add a detailed perception loss function. Meanwhile, to reduce the complexity of the algorithm, we improve the convolution group structure in the generator. Experiments show that our model achieves a good dehazing effect on both indoor and outdoor hazy images.",10.1109/ICACTE55855.2022.9943557,https://ieeexplore.ieee.org/stamp/stamp.jsp?arnumber=9943557,image dehazing;DAM-CCGAN;attention mechanism;unsupervised learning,1,,15
Multi-Scale Dehaze Network Based on Frequency Domain Assistance and Detailed Brightness Information Guidance,P. Yang; L. Wang,"University of Electronic Science and Technology of China, Chengdu, China; University of Electronic Science and Technology of China, Chengdu, China",2025,"Abstract—Optical image dehazing is a challenging task. Although both physical model-based and deep learning-based dehazing methods have achieved a certain degree of restoration results, they are all reflected in a single spatial domain processing, and deep learning methods have the problem of large models. We start from the flow of information, aiming to combine pixel and frequency domain information, redesign the up- and downsampling mechanism based on discrete wavelet transform, and separate the frequency spectrum of features in the neck network for auxiliary processing, making full use of frequency domain information to assist the dehazing process. Considering the basic nature of the dehazing task in image processing, we introduce feature fusion guided by brightness and texture information to restore higher quality clear and haze-free images. We conducted experiments on SOTS-Indoor, NH-haze, and Dense-haze datasets. The results show that on the Indoor dataset, as shown in Fig.1, Our model parameters and computational costs are reduced by at least 60%, achieving a 41.11dB effect with only 16.48GFlops of computational cost and 1.89M parameters.",10.1109/ICASSP49660.2025.10889749,https://ieeexplore.ieee.org/stamp/stamp.jsp?arnumber=10889749,,1,,28
Toward Zero-Shot Learning for Visual Dehazing of Urological Surgical Robots,R. Wu; X. Wang; P. Liang; Z. Zhang; Q. Chang; H. Tang,"Department of Surgery, Shanghai Key Laboratory of Gastric Neoplasms, Shanghai Institute of Digestive Surgery, Ruijin Hospital, Shanghai Jiao Tong University School of Medicine, Shanghai, China; Department of Urology, Ruijin Hospital, Shanghai Jiaotong University School of Medicine, Shanghai, China; Department of Surgery, Shanghai Key Laboratory of Gastric Neoplasms, Shanghai Institute of Digestive Surgery, Ruijin Hospital, Shanghai Jiao Tong University School of Medicine, Shanghai, China; School of Intelligent Science and Technology, Nanjing University, China; Department of Surgery, Shanghai Key Laboratory of Gastric Neoplasms, Shanghai Institute of Digestive Surgery, Ruijin Hospital, Shanghai Jiao Tong University School of Medicine, Shanghai, China; School of Computer Science, Peking University, Beijing, China",2025,"Robot-assisted surgery has profoundly influenced current forms of minimally invasive surgery. However, in transurethral urological surgical robots, they need to work in a liquid environment. This causes vaporization of the liquid when shearing and heating is performed, resulting in bubble atomization that affects the visual perception of the robot. This can lead to the need for uninterrupted pauses in the surgical procedure, which makes the surgery take longer. To address the atomization characteristics of liquids under urological surgical robotic vision, we propose an unsupervised zero-shot dehaze method (RSF-Dehaze). Specifically, the proposed Region Similarity Filling Module (RSFM) of RSF-Dehaze significantly improves the recovery of blurred region tissues. In addition, we organize and propose a dehaze dataset for robotic vision in urological surgery (USRobot-Dehaze dataset). In particular, this dataset contains the three most common urological surgical robot operation scenarios. To the best of our knowledge, we are the first to organize and propose a publicly available dehaze dataset for urological surgical robot vision. The proposed RSF-Dehaze proves the effectiveness of our method in three urological surgical robot operation scenarios with extensive comparative experiments with 20 most classical and advanced dehazing and image recovery algorithms. The proposed source code and dataset are available at https://github.com/wurenkai/RSF-Dehaze.",10.1109/ICRA55743.2025.11128076,https://ieeexplore.ieee.org/stamp/stamp.jsp?arnumber=11128076,,1,,33
Revamped Lane detection in hazy environments using Denoising Diffusion Probabilistic Model,S. Palanirajan; B. Natarajan; A. Baalaji; E. Joe,"School of Computer Science and Engineering, Vellore Institue of Technology Chennai Campus, Tamilnadu, India; School of Computer Science and Engineering, Vellore Institue of Technology Chennai Campus, Tamilnadu, India; School of Computer Science and Engineering, Vellore Institue of Technology Chennai Campus, Tamilnadu, India; School of Computer Science and Engineering, Vellore Institue of Technology Chennai Campus, Tamilnadu, India",2024,"In today’s world of rapidly growing technological markets, image processing has become vital for systems to work on visual data. A noteworthy task would be lane detection in autonomous vehicles. A good lane detection system should be able to perform the processing irrespective of the environment and this mandates that adequate preprocessing should be done. One such preprocessing step is image dehazing. Dehazing is particularly tricky with a heavily hazed image where the background object’s visibility is less than zero. To address this issue, methods like the Atmospheric Scattering Model (ASM) have been constructed to dehaze the image. However, these methods tend to lose the color details of the image. The Denoising Diffusion Probabilistic Model (DDPM) has recently emerged as a tool for image generation, showing promise in addressing this issue. This research work aims to build a hybrid model by combining the DDPM and ASM approaches named RevampedDehazingDDPM (RD-DDPM). The proposed model recreates the original image while maintaining the visual details to the plausible limit. The proposed model produced PNSR score of 38.59 dB, SSIM score of 0.0989 and LPIPS score of 0.0040 which showcases the outstanding performance of the proposed model.",10.1109/MoSICom63082.2024.10881636,https://ieeexplore.ieee.org/stamp/stamp.jsp?arnumber=10881636,Denoising Diffusion Probabilistic Model;Atmospheric Scattering Model;Image Dehazing;Convolutional Neural Network;Canny Edge Detector;Lane Detection,1,,36
Scene Text Detection in Foggy Weather Utilizing Knowledge Distillation of Diffusion Models,Z. Liu; G. Zhou; Z. Jia; F. Shi,"School of Computer Science and Technology, Xinjiang University, Urumqi, China; School of Computer Science and Technology, Xinjiang University, Urumqi, China; School of Computer Science and Technology, Xinjiang University, Urumqi, China; School of Computer Science and Technology, Xinjiang University, Urumqi, China",2025,"Adverse weather conditions can significantly hinder the performance of deep learning-based object detection models. Traditional approaches often rely on image restoration techniques to enhance the quality of degraded images prior to detection. However, these methods frequently struggle to balance image enhancement and detection tasks effectively, often overlooking latent information that could be beneficial for detection. To address these challenges, we propose a novel framework: Knowledge Distillation based on Diffusion Models (KDDM). This framework incorporates a Dehaze Network (DN), which employs large kernel convolution to remove weather-specific artifacts, thereby revealing more latent information. The DN, together with a text detector, forms an end-to-end scene text detection network, acting as the student network. Additionally, the nuanced internal representations of text-to-image diffusion models adeptly capture and integrate higher-order visual semantic concepts. Given the rich textual and visual content inherent in scene text, there is a fundamental connection to text-to-image diffusion models. As such, we utilize diffusion models as a teacher network to distill high-level visual semantic knowledge into the student network. Notably, we introduce an innovative distillation technique using a “Threshold_Mask”, which ensures that the student network focuses on text regions while minimizing interference from irrelevant background elements. Comprehensive experimental evaluations demonstrate that our KDDM framework significantly outperforms baseline models under foggy weather conditions, marking a substantial advancement in the field.",10.1109/LSP.2025.3540371,https://ieeexplore.ieee.org/stamp/stamp.jsp?arnumber=10878809,Diffusion models;knowledge distillation;adverse weather;scene text detection,1,,39
Crowd Counting and Localization in Haze and Rain,W. Yuan; Z. Li; X. Li; L. Fang; Q. Zhang; Z. Qiu,"College of Information Science and Technology, Jinan University, Guangzhou, China; College of Information Science and Technology, Jinan University, Guangzhou, China; College of Information Science and Technology, Jinan University, Guangzhou, China; College of Information Science and Technology, Jinan University Pazhou Lab, Guangzhou, China; College of Information Science and Technology, Jinan University, Guangzhou, China; Independent Researcher, Toronto, Canada",2024,"Adverse weather conditions such as haze and fog often significantly reduce the performance of crowd counting models. An intuitive solution is to preprocess degraded images by applying image restoration techniques prior to crowd counting. However, this solution introduces additional computational complexity and may produce restored images with noise and artifacts that is harmful to the subsequent crowd counting task. To mitigate the two issues, we integrate an image restoration module (IRM) into a unified framework to propose an effective network for crowd counting and localization in haze and rain. The lightweight IRM is designed to guide the network to learn haze-aware knowledge in feature space, which is removed in the inference phase without increasing the computational cost. In addition, two new datasets are constructed to evaluate the crowd counting methods in haze and rain. Extensive experiments on both synthetic and real-world datasets demonstrate the superiority of the proposed method. The code is available at https://github.com/lizhangray/Dehaze-P2PNet.",10.1109/ICME57554.2024.10687579,https://ieeexplore.ieee.org/stamp/stamp.jsp?arnumber=10687579,crowd counting and localization;image dehazing;joint learning;adverse weather,1,,20
Patch-Based Dark Channel Prior Dehazing for RS Multi-Spectral Image,L. Wang; W. Xie; J. Pei,"ATR Key Laboratory of National Defense Technology, College of Information Engineering, Shenzhen University, Shenzhen, China; ATR Key Laboratory of National Defense Technology, College of Information Engineering, Shenzhen University, Shenzhen, China; ATR Key Laboratory of National Defense Technology, College of Information Engineering, Shenzhen University, Shenzhen, China",2015,"Remote sensing(RS) multi-spectral images are usually suffered from cloud and fog cover, which can lead to analysis troubles and application limitations. A novel patch-based dark channel prior dehaze method is proposed for solving this problem. An Atmospheric light (AL) curved surface hypothesis, instead of globally invariable plane, is applied to describe AL distribution, and a patch-based approach is given to estimate curved surface. By using AL curved surface estimation, a new recovering model for RS multi-spectral images is given to obtain dehaze-free images. Comparative experiments are conducted, those results illustrate that the proposed method can produces visually impressive restored images, and the proposed method is superior to other relative methods in terms of image quality evaluations.",10.1049/cje.2015.07.023,https://ieeexplore.ieee.org/stamp/stamp.jsp?arnumber=10855313,RS multi-spectral images;Dehaze;Cloud and fog removal;Dark channel prior;AL curved surface,,,27
Single Image Very Deep Super Resolution (SIVDSR) Dehaze,S. Roy; S. S. Chaudhuri,"ECE Department, Narula Institute of Technology, Kolkata, India; ETCE Department, Jadavpur University, Kolkata, India",2021,"Adverse climate conditions affect digital photography causing colour shifting, poor visibility, contrast reduction, and fainted appearance due to the scattering of atmospheric Particulate Matter (APM). To get an optimum transmission matrix is the key success of any single image dehazing technique. Deep Learning based Super Resolution technique with VDSR 20-weighted Layers ImageNet classifier improves any image resolution leading to noise suppression. High Residual Learning gradient clipping makes the algorithm converge fast with denoising and removal of artifacts by compression. This key observation has been exercised in improving resolution of the hazy images with an optical image formation model. In addition, benchmark established images are evaluated and their comparisons to the state-of-the-art methods show a consistent improvement in accurate scene transmission estimation resulting in clear, natural haze-free radiance. A good balance between execution speed and processing speed has been achieved.",10.1109/BECITHCON54710.2021.9893583,https://ieeexplore.ieee.org/stamp/stamp.jsp?arnumber=9893583,VDSR;Dehazing;APM;optical image formation model;SIVDSR;MOSF;VIA,,,30
Using Physical Models and Image Processing Techniques Efficient Dehazing Algorithm Prior,B. Chen,"Shandong University of Science and Technology, Tai'an, China",2023,"To improve this human production and living environment and Currently, there are various dehazing techniques available, but they are limited in their effectiveness. But these methods have certain limitations in the dehazing effect. In this paper, we provide an excellent image dehazing method, by introducing a weighting function to optimize and minimize the scattering coefficient, obtain a more accurate scattering map, and complete the dehazing of the image. The distortion in the image is caused by a combination of clear images and environmental factors, so a technology is developed that can remove the color veil of hazy images. Specific comparisons have shown that these studies have improved dehazing performance in several ways, making the recovered images more realistic.",10.1109/ICIPCA59209.2023.10257861,https://ieeexplore.ieee.org/stamp/stamp.jsp?arnumber=10257861,Dehaze;adaptive color correction;restraint,,,14
GUSL-Dehaze: A Green U-Shaped Learning Approach to Image Dehazing,M. Movaheddrad; L. Palmer; C. . -C. J. Kuo,"University of Southern California, Los Angeles, California, USA; University of Southern California, Los Angeles, California, USA; University of Southern California, Los Angeles, California, USA",2025,"Image dehazing is a restoration task that aims to recover a clear image from a single hazy input. Traditional approaches rely on statistical priors and the physics-based atmospheric scattering model to reconstruct the haze-free image. While recent state-of-the-art methods are predominantly based on deep learning architectures, these models often involve high computational costs and large parameter sizes, making them unsuitable for resource-constrained devices. In this work, we propose GUSL-Dehaze, a Green U-Shaped Learning approach to image dehazing. Our method integrates a physics-based model with a green learning (G L) framework, offering a lightweight, transparent alternative to conventional deep learning techniques. Unlike neural network-based solutions, GUSL-Dehaze completely avoids deep learning. Instead, we begin with an initial dehazing step using a modified Dark Channel Prior (DCP), which is followed by a green learning pipeline implemented through a U -shaped architecture. This architecture employs unsupervised representation learning for effective feature extraction, together with feature-engineering techniques such as Relevant Feature Test (RFT) [1] and Least-Squares Normal Transform (LNT) [2] to maintain a compact model size. Finally, the dehazed image is obtained via a transparent supervised learning strategy. G USL-Dehaze significantly reduces parameter count while ensuring mathematical interpretability and achieving performance on par with state-of-the-art deep learning models.",10.1109/MIPR67560.2025.00015,https://ieeexplore.ieee.org/stamp/stamp.jsp?arnumber=11225928,Image Dehazing;Green Learning;Machine Learning;Image Restoration,,,30
Adaptive Network-Based Pedestrian Detection in Haze Environment,S. Jiang; X. Chen; L. Wang; Z. Ye,"School of Computer Science and Engineering, Wuhan Institute of Technology, Wuhan, China; School of Computer Science and Engineering, Wuhan Institute of Technology, Wuhan, China; School of Computer Science and Engineering, Wuhan Institute of Technology, Wuhan, China; School of Computer Science and Engineering, Wuhan Institute of Technology, Wuhan, China",2023,"The task of image dehazing, which involves the extraction of atmospheric haze from an image, presents a significant challenge due to the necessity of haze removal without detriment to the inherent quality of the image. The density of haze is subject to considerable variation, and as a result, extant dehazing algorithms frequently struggle to effectively manage differing haze densities. This often culminates in issues such as color distortion, loss of detail, and the emergence of other artifacts. In response to these challenges, this study introduces an innovative adaptive image dehazing algorithm. This algorithm employs a Generative Adversarial Network (GAN) as its foundational structure. Furthermore, an attention mechanism is integrated into the algorithm with the aim of preventing detail loss and concentrating on salient feature information. The proposed algorithm is subjected to rigorous evaluation across diverse datasets. The results demonstrate that it surpasses existing methods in terms of both image quality and robustness in relation to varying haze densities.",10.1109/ICICML60161.2023.10424899,https://ieeexplore.ieee.org/stamp/stamp.jsp?arnumber=10424899,image dehaze;attention mechanism;GAN;adaptive neural network,,,13
AquaVision Dehaze and enhancement: a robust algorithm for improving underwater image quality in aquatic environments,V. M; S. A; S. J S; P. Prakash,"School of Electronics Engineering, Vellore Institute of Technology, Chennai, India; Centre for Advanced Data Science, Vellore Institute of Technology, Chennai, India; School of Computer Science and Engineering, Vellore Institute of Technology, Chennai, India; Department of Electronics Engineering, Madras Institute of Technology, Chennai, India",2024,"Underwater imaging is frequently challenged by light scattering, leading to haze, color distortion, and visibility loss. To address these issues, we introduce the AquaVision Dehaze and Enhancement algorithm to improve underwater image quality. Extensive testing on a dataset from an aquaculture environment demonstrates that the algorithm significantly enhances image clarity. Quantitative evaluations reveal high performance across various image quality metrics, with scores of UICM (19.6463), UISM (18.1490), UIConM (26.7463), and UIQM (13.3312). Furthermore, the algorithm delivers competitive results in no-reference image quality metrics, including NIQE (3.6780), Entropy (7.5942), PIQE (52.1444), and BRISQUE (35.9847). These results highlight the algorithm’s effectiveness in addressing the challenges of underwater imaging and illustrate the effectiveness through an ablation study. The AquaVision Dehaze and Enhancement algorithm offers a robust solution for improving the quality making it a valuable tool for advancing research in aquatic environments.",10.1049/icp.2024.4411,https://ieeexplore.ieee.org/stamp/stamp.jsp?arnumber=10853748,,,,
Underwater Fish Image Enhancement Algorithm Based on Dark Channel Prior and Retinex,L. Zou; W. Tan; Z. Chen; J. Wan,"College of Information and Smart Electromechanical Engineering, Xiamen Huaxia University, Xiamen, China; College of Information and Smart Electromechanical Engineering, Xiamen Huaxia University, Xiamen, China; College of Information and Smart Electromechanical Engineering, Xiamen Huaxia University, Xiamen, China; College of Information and Smart Electromechanical Engineering, Xiamen Huaxia University, Xiamen, China",2023,"Due to the intricate underwater conditions and lighting challenges prevalent in marine farms, underwater fish images often suffer from issues like blurriness, low contrast, color distortion, and uneven illumination. In response to these hurdles, we present an underwater fish image enhancement algorithm that leverages the dark channel prior and Retinex. We commence by applying the dark channel prior to dehaze underwater fish images. To discriminate between foreground and background regions within the image, we employ a superpixels segmentation technique based on variations in image brightness. Consequently, we employ a multi-scale Retinex enhancement on each region and perform a secondary enhancement exclusively on the background region. Finally, a Poisson fusion method is utilized to amalgamate the enhanced foreground and background segments, resulting in a unified composite image. We conducted comprehensive experiments employing the Underwater Image Enhancement Benchmark Dataset (UIEBD). The experimental findings substantiate the efficacy of the proposed algorithm, with notable improvements observed across three key evaluation metrics: information entropy, average gradient, and standard deviation. These enhancements translate to an average percentage increase of 18.22%, 133.67%, and 59.29%, respectively. Additionally, the algorithm notably enhances underwater fish image clarity and ameliorates issues related to uneven illumination. It demonstrates superior aptitude in preserving image intricacies and elevating contrast when juxtaposed with alternative algorithms, substantiating its superior performance.",10.1109/ICICML60161.2023.10424800,https://ieeexplore.ieee.org/stamp/stamp.jsp?arnumber=10424800,underwater images;fish;dark channel prior;Retinex;uneven illumination,,,23
